{
  "$schema": "https://schemas.ironicbuddha.dev/project-standards/v1/fixture.schema.json",
  "schemaVersion": "1.0.0",
  "id": "fixture/verification/no-op",
  "subject": "verification",
  "expectation": "verified",
  "document": {
    "binding": "exact",
    "suppression": "matching",
    "repetitions": 2
  }
}
